{
  "$schema": "https://json-schema.org/draft/2020-12/schema",
  "$id": "https://agentbox.local/protocols/worker/v1.schema.json",
  "title": "AgentBox Worker v1 request payload",
  "type": "object",
  "additionalProperties": false,
  "required": [
    "requestId",
    "connectionId",
    "serverInstanceId",
    "op",
    "arguments"
  ],
  "properties": {
    "requestId": {
      "$ref": "#/$defs/id"
    },
    "connectionId": {
      "$ref": "#/$defs/id"
    },
    "serverInstanceId": {
      "$ref": "#/$defs/id"
    },
    "attemptId": {
      "$ref": "#/$defs/id"
    },
    "generation": {
      "type": "integer",
      "minimum": 1
    },
    "op": {
      "enum": [
        "handshake",
        "heartbeat",
        "browse",
        "canonicalize",
        "workspace.get",
        "workspace.list",
        "view.prepare",
        "view.put",
        "view.commit",
        "view.list",
        "view.get",
        "view.cleanup",
        "secret.put",
        "secret.cleanup",
        "spawn",
        "observe",
        "cancel",
        "result.get",
        "result.ack",
        "attempt.write",
        "attempt.cleanup",
        "stdin.close",
        "home.prepare",
        "home.put",
        "home.list",
        "home.get",
        "home.delete"
      ]
    },
    "arguments": {
      "type": "object"
    }
  },
  "$defs": {
    "id": {
      "type": "string",
      "minLength": 1,
      "maxLength": 128,
      "pattern": "^[A-Za-z0-9._-]+$"
    },
    "bootstrap": {
      "type": "object",
      "additionalProperties": false,
      "required": [
        "workerVersion",
        "workerDigest",
        "connectionId",
        "projectId",
        "effectiveUser",
        "instanceNonce",
        "serverInstanceId",
        "leaseMs",
        "protocolVersion"
      ],
      "properties": {
        "workerVersion": {
          "type": "string",
          "minLength": 1,
          "maxLength": 1024
        },
        "workerDigest": {
          "type": "string",
          "pattern": "^sha256:[0-9a-f]{64}$"
        },
        "connectionId": {
          "$ref": "#/$defs/id"
        },
        "projectId": {
          "$ref": "#/$defs/id"
        },
        "effectiveUser": {
          "type": "string",
          "minLength": 1,
          "maxLength": 1024
        },
        "instanceNonce": {
          "$ref": "#/$defs/id"
        },
        "serverInstanceId": {
          "$ref": "#/$defs/id"
        },
        "leaseMs": {
          "type": "integer",
          "minimum": 1000,
          "maximum": 120000
        },
        "protocolVersion": {
          "description": "Control-protocol generation. Current is 4: runtime artifact trees are verified by the Worker, and the persistent home operation family (home.prepare / home.list / home.get) exists. A different value is a loud, two-way handshake refusal.",
          "const": 4
        },
        "executables": {
          "type": "array",
          "maxItems": 16,
          "items": {
            "type": "object",
            "additionalProperties": false,
            "required": [
              "path",
              "digest"
            ],
            "properties": {
              "path": {
                "type": "string",
                "minLength": 1,
                "maxLength": 4096
              },
              "digest": {
                "type": "string",
                "pattern": "^sha256:[0-9a-f]{64}$"
              }
            }
          }
        },
        "runtimeArtifacts": {
          "description": "Immutable runtime dependency directories. The Worker re-derives each treeDigest inside WSL and refuses the handshake on any mismatch; only then may bwrap read-only bind one at target.",
          "type": "array",
          "maxItems": 8,
          "items": {
            "type": "object",
            "additionalProperties": false,
            "required": [
              "path",
              "target",
              "treeDigest"
            ],
            "properties": {
              "path": {
                "description": "Canonical absolute WSL path of a real directory, never a symlink.",
                "type": "string",
                "minLength": 1,
                "maxLength": 4096,
                "pattern": "^/[^\\u0000/]+(/[^\\u0000/]+)*$"
              },
              "target": {
                "description": "Restricted guest mount point.",
                "type": "string",
                "pattern": "^/runtime/artifacts/[A-Za-z0-9][A-Za-z0-9._-]{0,63}$"
              },
              "treeDigest": {
                "description": "sha256 of the canonical tree encoding defined by protocols/worker/golden/runtime-artifact-tree-v1.json.",
                "type": "string",
                "pattern": "^sha256:[0-9a-f]{64}$"
              }
            }
          }
        }
      }
    }
  }
}
